[
  {
    "enchantmentId": "axeofsacrifice",
    "categoryId": "veda",
    "level": 1,
    "number": 1,
    "usage": "N/A",
    "name": "Tương phản",
    "description": "Sát thương gây ra cho tướng địch tăng 3% nhưng sát thương phải chịu cũng tăng lên 2% (tướng cận chiến chỉ thêm 1%)",
    "asset": "enchantments/A11_AxeofSacrifice.webp"
  },
  {
    "enchantmentId": "manarefill",
    "categoryId": "veda",
    "level": 1,
    "number": 2,
    "usage": "Hồi chiêu: 5 giây",
    "name": "Sung mãn",
    "description": "Tung chiêu hoặc đòn đánh thường trúng tướng địch sẽ được hồi 8% năng lượng tối đa",
    "asset": "enchantments/A12_ManaRefill.webp"
  },
  {
    "enchantmentId": "sacredbead",
    "categoryId": "veda",
    "level": 1,
    "number": 3,
    "usage": "N/A",
    "name": "Thánh châu",
    "description": "Chiêu cuối được giảm thời gian hồi chiêu thêm 10% (nhưng không được vượt quá 40% tối đa)",
    "asset": "enchantments/A13_SacredBead.webp"
  },
  {
    "enchantmentId": "blessing",
    "categoryId": "veda",
    "level": 2,
    "number": 1,
    "usage": "N/A",
    "name": "Bí quyết",
    "description": "Bạn được nhận thêm 16% chí mạng và thêm 8% công phép từ trang bị",
    "asset": "enchantments/A21_Blessing.webp"
  },
  {
    "enchantmentId": "holyverdict",
    "categoryId": "veda",
    "level": 2,
    "number": 2,
    "usage": "N/A",
    "name": "Xuyên tâm",
    "description": "Nhận 18-60 xuyên giáp / xuyên giáp phép",
    "asset": "enchantments/A22_HolyVerdict.webp"
  },
  {
    "enchantmentId": "holysummoner",
    "categoryId": "veda",
    "level": 3,
    "number": 1,
    "usage": "Hồi chiêu: 10 giây",
    "name": "Tinh linh",
    "description": "Đòn đánh thường thứ 3 liên tiếp trúng một tướng địch sẽ nhận được một vòng sáng tiểu thiên thần quanh cơ thể trong 5 giây. Tiểu thiên thần sẽ tự động công kích kẻ địch bị chủ nhân tấn công trong phạm vi 9.5m. Tốc đánh bằng tốc đánh của chủ nhân và lực công kích bằng 2% máu tối đa của mục tiêu chuyển thành sát thương chuẩn",
    "asset": "enchantments/A31_HolySummoner.webp"
  },
  {
    "enchantmentId": "holythunder",
    "categoryId": "veda",
    "level": 3,
    "number": 2,
    "usage": "Hồi chiêu: 12 giây",
    "name": "Thần quang",
    "description": "Tung chiêu hoặc đánh thường đầu tiên trúng tướng địch sẽ tạo thành sát thương sấm sét gây 88-200 (+30% công phép) sát thương phép. Những chiêu hoặc đòn đánh thường tung sau đó sẽ giảm thời gian hồi chiêu 1 giây (khoảng cách giữa 2 lần giảm hồi chiêu phải lớn hơn 0.5 giây)",
    "asset": "enchantments/A32_HolyThunder.webp"
  },
  {
    "enchantmentId": "sacredprotection",
    "categoryId": "veda",
    "level": 3,
    "number": 3,
    "usage": "Hồi chiêu: 30 giây",
    "name": "Thánh thuẫn",
    "description": "Trong thời gian ngắn nhận sát thương vượt quá 30% máu của bản thân sẽ lập tức được nhận lá chắn miễn 430-850 sát thương và 20% hút máu phép trong 6 giây, hạ hoặc phụ hạ trong thời gian này sẽ kéo dài hút máu phép trong 3 giây",
    "asset": "enchantments/A33_SacredProtection.webp"
  },
  {
    "enchantmentId": "devourer",
    "categoryId": "lokheim",
    "level": 1,
    "number": 1,
    "usage": "N/A",
    "name": "Hấp huyết",
    "description": "Hạ hoặc phụ sẽ được hồi 9% máu bản thân đã mất và 15 năng lượng·",
    "asset": "enchantments/B11_Devourer.webp"
  },
  {
    "enchantmentId": "shadowblade",
    "categoryId": "lokheim",
    "level": 1,
    "number": 2,
    "usage": "N/A",
    "name": "Dư ảnh",
    "description": "Mỗi khi dùng lướt sẽ được cộng dồn 1 dư ảnh trong 4 giây, tối đa cộng dồn 3 dư ảnh. Đòn đánh thường sau đấy sẽ tiêu hao hết toàn bộ số dư ảnh. Mỗi dư ảnh gây 30 (+5 / cấp tướng) + (10% công vật lý thêm) sát thương vật lý",
    "asset": "enchantments/B12_ShadowBlade.webp"
  },
  {
    "enchantmentId": "raginginferno",
    "categoryId": "lokheim",
    "level": 1,
    "number": 3,
    "usage": "Hồi chiêu: 8 giây",
    "name": "Ma hỏa",
    "description": "Tung chiêu hoặc đòn đánh thường trúng tướng địch sẽ gây 55-125 (+15% công phép) sát thương phép",
    "asset": "enchantments/B13_RagingInferno.webp"
  },
  {
    "enchantmentId": "deadlyclaw",
    "categoryId": "lokheim",
    "level": 2,
    "number": 1,
    "usage": "N/A",
    "name": "Cường công",
    "description": "Nhận 10-38 công vật lý và 15-57 công phép",
    "asset": "enchantments/B21_DeadlyClaw.webp"
  },
  {
    "enchantmentId": "bonecutter",
    "categoryId": "lokheim",
    "level": 2,
    "number": 2,
    "usage": "N/A",
    "name": "Cố thủ",
    "description": "Nhận được 12.5% kháng hiệu ứng",
    "asset": "enchantments/B22_BoneCutter.webp"
  },
  {
    "enchantmentId": "hometurf",
    "categoryId": "lokheim",
    "level": 2,
    "number": 3,
    "usage": "Khi ở trong phạm vi nửa bản đồ phe ta",
    "name": "Sân nhà",
    "description": "Tăng 3% tốc chạy và 3% sát thương gây ra",
    "asset": "enchantments/B23_HomeTurf.webp"
  },
  {
    "enchantmentId": "desperateduel",
    "categoryId": "lokheim",
    "level": 3,
    "number": 1,
    "usage": "N/A",
    "name": "Đấu khí",
    "description": "Tung chiêu hoặc đánh thường trúng tướng địch sẽ được tăng 2 tốc chạy trong 3 giây (tướng đánh xa mỗi đòn được cộng dồn 1 tầng. tướng đánh gần mỗi đòn được cộng dồn 2 tầng), tối đa cộng dồn được 10 tầng. Khi đủ 10 tầng sẽ được hồi 10% máu bản thân đã mất và nhận thêm 15% xuyên giáp & xuyên giáp phép",
    "asset": "enchantments/B31_DesperateDuel.webp"
  },
  {
    "enchantmentId": "curseofdeath",
    "categoryId": "lokheim",
    "level": 3,
    "number": 2,
    "usage": "Hồi chiêu: 15 giây",
    "name": "Ma chú",
    "description": "Tung chiêu hoặc đòn đánh thường trúng tướng địch sẽ cộng dồn 1.5 giây dấu ấn, đủ 3 dấu ấn sẽ gây trong phạm vi 2.5m quanh mục tiêu 44-100 (+25% cộng vật lý thêm) (+15% công phép) sát thương phép. Sau 1 giây gây tiếp trong phạm vi 2.5m quanh mục tiêu sát thương phép tương đương 6% máu đã mất của nạn nhân (mỗi 100 công vật lý thêm hoặc 200 công phép tăng 1%)",
    "asset": "enchantments/B32_CurseofDeath.webp"
  },
  {
    "enchantmentId": "devilsawakening",
    "categoryId": "lokheim",
    "level": 3,
    "number": 3,
    "usage": "Hồi chiêu: 30 giây",
    "name": "Ma tính",
    "description": "Sau khi tung chiêu cuối lập tức giảm 30% thời gian hồi các chiêu khác và nhận 20% Giảm Hồi Chiêu trong 6 giây (thông số cơ bản, tính vào giới hạn 40% tối đa). Hạ hoặc phụ hạ sẽ kéo dài hiệu ứng thêm 3 giây.",
    "asset": "enchantments/B33_DevilsAwakening.webp"
  },
  {
    "enchantmentId": "rivertreader",
    "categoryId": "afata",
    "level": 1,
    "number": 1,
    "usage": "Trên đường sông",
    "name": "Nhạy bén",
    "description": "Được nhận thêm 10 tốc chạy và hồi thêm 20 máu cùng 10 năng lượng mỗi 5 giây",
    "asset": "enchantments/C11_RiverTreader.webp"
  },
  {
    "enchantmentId": "backstabbing",
    "categoryId": "afata",
    "level": 1,
    "number": 2,
    "usage": "Hồi chiêu: 10 giây",
    "name": "Ám kích",
    "description": "Ở trong bụi cỏ tung đòn đánh thường sẽ cộng thêm 4% sát thương chuẩn dựa trên lượng máu của kẻ địch khi đó. Rời khỏi bụi cỏ sau 4 giây vẫn nhận được hiệu quả này",
    "asset": "enchantments/C12_Backstabbing.webp"
  },
  {
    "enchantmentId": "towerblessing",
    "categoryId": "afata",
    "level": 1,
    "number": 3,
    "usage": "Khi đứng gần trụ (phạm vi 6m)",
    "name": "Canh gác",
    "description": "Bản thân được nhận 15% kháng hiệu ứng và 10% miễn thương",
    "asset": "enchantments/C13_TowerBlessing.webp"
  },
  {
    "enchantmentId": "regrowth",
    "categoryId": "afata",
    "level": 2,
    "number": 1,
    "usage": "N/A",
    "name": "Bơm máu",
    "description": "Hiệu quả hồi máu và lá chắn của bản thân tăng 10%. Nếu máu của mục tiêu thấp dưới 50%, hiệu quả này sẽ tăng thêm 10% nữa (bao gồm trang bị, kỹ năng phụ trợ)",
    "asset": "enchantments/C21_Regrowth.webp"
  },
  {
    "enchantmentId": "naturesgift",
    "categoryId": "afata",
    "level": 2,
    "number": 2,
    "usage": "N/A",
    "name": "Sinh tồn",
    "description": "Lính và quái rừng bị hạ gục phụ cận khiến bản thân được tăng máu tối đa vĩnh viễn (lính cộng 1 tầng, quái rừng nhỏ cộng 2 tầng, quái rừng to cộng 3 tầng, mỗi tầng được 8 máu, tối đa được cộng 100 tầng)",
    "asset": "enchantments/C22_NaturesGift.webp"
  },
  {
    "enchantmentId": "vitalaid",
    "categoryId": "afata",
    "level": 2,
    "number": 3,
    "usage": "Hồi chiêu: 15 giây",
    "name": "Cứu viện",
    "description": "Tạo một gói máu nhỏ bay đến đồng minh thấp máu nhất lân cận, hồi 225-435 máu",
    "asset": "enchantments/C23_VitalAid.webp"
  },
  {
    "enchantmentId": "naturesrage",
    "categoryId": "afata",
    "level": 3,
    "number": 1,
    "usage": "Hồi chiêu: 20 giây",
    "name": "Trói buộc",
    "description": "Khi tung chiêu khống chế trúng tướng địch (khiêu khích, hất tung, đánh lui, làm choáng, hóa đá...) sẽ giúp bản thân nhận hiệu quả thiêu đốt, mỗi 0.5 giây gây sát thương phép bằng 2% lượng máu tối đa trong 3 giây. Tướng địch bị thiêu đốt sẽ giảm 33-75 giáp phép",
    "asset": "enchantments/C31_NaturesRage.webp"
  },
  {
    "enchantmentId": "explosiveshield",
    "categoryId": "afata",
    "level": 3,
    "number": 2,
    "usage": "Hồi chiêu: 10 giây",
    "name": "Mộc giáp",
    "description": "Gánh chịu sát thương sẽ cộng dồn (mỗi giây tính 1 lần) trong 3 giây, đủ 4 lần giúp bản thân gây sát thương phép bằng 2% máu tối đa của bản thân trong phạm vi 4m đồng thời hồi 5% máu tối đa, mỗi khi trúng thêm 1 tướng địch sẽ giúp hồi thêm 2% máu tối đa",
    "asset": "enchantments/C32_ExplosiveShield.webp"
  },
  {
    "enchantmentId": "forestwanderer",
    "categoryId": "afata",
    "level": 3,
    "number": 3,
    "usage": "Sau khi rời khỏi giao tranh",
    "name": "Du hiệp",
    "description": "Rời khỏi giao tranh một lúc sẽ khiến đòn đánh thường kế tiếp làm chậm địch 30% trong 1 giây và gắn lên địch một dấu ấn bùng nổ. Sau 3 giây nó sẽ nổ tung gây 8% máu tối đa của bản thân thành ST phép",